{"$schema":"https://json-schema.org/draft/2020-12/schema","type":"object","required":["as_of","data_through","model_version","model_commit_date","config_hash","vintages","geography_vintage","disclaimer","thresholds"],"properties":{"as_of":{"type":"string"},"data_through":{"type":["string","null"]},"model_version":{"type":"string","minLength":7},"model_commit_date":{"type":["string","null"]},"config_hash":{"type":["string","null"]},"vintages":{"type":"object"},"geography_vintage":{"type":["string","null"]},"disclaimer":{"type":"string"},"thresholds":{"type":"object","required":["hedgeable_he","hedgeable_lb","stability_threshold","pit_min_oos"]}}}
