{"as_of":"2026-07-01","config_hash":"fdb7f34b315aa21c","data_through":"2026-06-30","disclaimer":"Research and education only. Model estimates are not executable quotes, offers, insurance or advice.","geography_vintage":"us-atlas@3","model_commit_date":"2026-09-03T02:22:56-04:00","model_version":"877886d32c4e14946c468ee562756a4d93b33d1a","thresholds":{"hedgeable_he":0.5,"hedgeable_lb":0.25,"pit_min_oos":5,"stability_threshold":0.6},"vintages":{"ghcnd":{"id":"ghcnd_snap2026-09-02"},"ghcnd_meta":{"id":"ghcnd_meta_snap2026-09-02"},"homr":{"id":"homr_snap2026-09-02"},"nclimgrid_tavg":{"end":"2026-06","id":"nclimgrid-daily_v1-0-0_snap2026-07-30","start":"1951-01","status":"scaled"},"nclimgrid_tmax":{"end":"2026-06","id":"nclimgrid-daily_v1-0-0_snap2026-09-02","start":"2023-01","status":"scaled","usable_through":"2025-12"},"nclimgrid_tmin":{"end":"2026-06","id":"nclimgrid-daily_v1-0-0_snap2026-09-02","start":"2023-01","status":"scaled","usable_through":"2025-12"}}}